<?xml version='1.0' encoding='utf-8' ?>
<!ELEMENT character (id, current-fate-points, experience-points, aspects, skills, stress?, stunts, consequences?, experiences?, notes?)>

  <!ELEMENT id (charname, playername, affiliation, description?)>
    <!ELEMENT charname (#PCDATA)>
    <!ATTLIST charname nickname CDATA #IMPLIED>
    <!ELEMENT playername (#PCDATA)>
    <!ELEMENT affiliation (#PCDATA)>
    <!ELEMENT description (#PCDATA)>

    <!ELEMENT current-fate-points (#PCDATA)>
    <!ELEMENT experience-points (#PCDATA)>

    <!ELEMENT aspects (aspect*)>
      <!ELEMENT aspect (#PCDATA)>
      <!ATTLIST aspect type (Concept|Mode|Omega) #REQUIRED>
      <!ATTLIST aspect mode-name CDATA           #IMPLIED>
      <!ATTLIST aspect signature (true|false)    #IMPLIED>

    <!ELEMENT skills (mode*, skill*)>
      <!ELEMENT mode (skill*)>
      <!ATTLIST mode name   CDATA #REQUIRED>
      <!ATTLIST mode rating CDATA #REQUIRED>
      <!ATTLIST mode stress-type (mental|physical|split) #IMPLIED>
        <!ELEMENT skill (#PCDATA)>
        <!ATTLIST skill name   CDATA #REQUIRED>
        <!ATTLIST skill rating CDATA #IMPLIED>
        <!ATTLIST skill add    CDATA #IMPLIED>
        <!ATTLIST skill cost   CDATA #IMPLIED> <!-- For Weird calculations -->

    <!ELEMENT stunts (stunt*, gadget*)>
      <!ELEMENT stunt (#PCDATA)>
      <!ATTLIST stunt name     CDATA    #IMPLIED>
      <!ELEMENT gadget (benefits*)>
      <!ATTLIST gadget name     CDATA    #IMPLIED>
      <!ATTLIST gadget function CDATA    #IMPLIED>
      <!ATTLIST gadget flaw     CDATA    #IMPLIED>
      <!ELEMENT benefits (benefit*)>
        <!ELEMENT benefit (#PCDATA)>
        <!ATTLIST benefit cost CDATA    #IMPLIED>
        <!ATTLIST benefit name CDATA    #IMPLIED>

    <!ELEMENT consequences (consequence*)>
      <!ELEMENT consequence (#PCDATA)>
        <!ATTLIST consequence effect CDATA #IMPLIED>
        <!ATTLIST consequence severity (Mild|Moderate|Severe|Mild-Physical|Mild-Mental) #REQUIRED>

    <!ELEMENT experiences (experience*)>
      <!ELEMENT experience (#PCDATA)>
      <!ATTLIST experience used (true|false) #IMPLIED>

    <!ELEMENT notes (#PCDATA)>
