<?xml version = '1.0'?>
<?xml-stylesheet type="text/xsl" href="../../xslt/atomic-robo_html.xsl"?>
<!DOCTYPE atomic-robo SYSTEM "../AtomicRobo/atomic-robo.dtd">
<character>
 <id>
  <charname>Legion</charname>
  <playername>Supporting NPC</playername>
  <affiliation>&#160;</affiliation>
  <description>&#160;</description>
 </id>
 <current-fate-points>0</current-fate-points>
 <experience-points>0</experience-points>
 <aspects>
   <aspect type="Concept">
     Braintape in Multiple Mechanical Insectoid Bodies
   </aspect>
   <aspect type="Mode" mode-name="Combat&#160;Stealthbot">
     Wall-Crawling Infiltrator
   </aspect>
   <aspect type="Mode" mode-name="Science">
     Broad But Shallow Generalist
   </aspect>
   <aspect type="Mode" mode-name="Thief">
     &#160;
   </aspect>
   <aspect type="Omega">
     &#160;
   </aspect>
 </aspects>
 <skills>
   <mode rating="3" name="Combat&#160;Stealthbot" stress-type="split">
   <skill name="Athletics" cost="2"/>
   <skill name="Burglary"  cost="1"/>
   <skill name="Combat"    cost="2"/>
   <skill name="Physique"  cost="1"/>
   <skill name="Stealth"   cost="2"/>
   <skill name="Will"      cost="1"/>
  </mode>
  <mode rating="2" name="Science" stress-type="mental"> <!-- ARRPG pg85 -->
   <skill name="Notice"               cost="1"/>
   <skill name="Will"                 cost="1"/>
   <skill name="(all other Sciences)" cost="1"/>
  </mode>
  <!--
       Specialize one trained skill.
       Focus one trained skill.
       Specialize one focused skill.
  -->
  <mode rating="1" name="Thief" stress-type="physical"> <!-- ARRPG pg288 -->
   <skill name="Athletics" cost="2"/>
   <skill name="Burglary"  cost="1"/>
   <skill name="Notice"    cost="1"/>
   <skill name="Stealth"   cost="2"/>
   <!-- 4 pts of Improvements -->
  </mode>
 </skills>
 <stunts>
  <stunt name=" ">&#160;</stunt>
  <stunt name=" ">&#160;</stunt>
  <stunt name=" ">&#160;</stunt>
  <stunt name=" ">&#160;</stunt>
  <stunt name=" ">&#160;</stunt>
 </stunts>
 <consequences>
 </consequences>
 <experiences>
  <experience/>
  <experience/>
  <experience/>
 </experiences>
 <notes>
   4 pts of Improvements from Thief mode
   If one of your modes is Science, also apply ALL of the following improvements:
  * Specialize one trained skill.
  * Focus one trained skill.
  * Specialize one focused skill.
 </notes>
</character>
