<?xml version="1.0" encoding="utf8"?>
<?xml-stylesheet type="text/xsl" href="../../xslt/atomic-robo_html.xsl"?>
<!DOCTYPE atomic-robo SYSTEM "../AtomicRobo/atomic-robo.dtd">
<character>
  <id>
    <charname>Steve Rogers / Cpt. America</charname>
    <playername>Supporting NPC</playername>
    <affiliation>Strategic Scientific Reserve</affiliation>
    <description>Specifically the version from Cpt. America: The First Avenger</description>
  </id>
  <current-fate-points>4</current-fate-points>
  <experience-points>0</experience-points>
  <aspects>
    <aspect type="Concept">
    The Sentinel of Liberty
  </aspect>
    <aspect type="Mode" mode-name="Super&#160;Soldier">
    Just a Kid From Brooklyn
  </aspect>
    <aspect type="Mode" mode-name="Soldier">
    "I Don't Like Bullies. I Don't Care Where They're From."
  </aspect>
    <aspect type="Mode" mode-name="Action">
    "I Can Do This All Day."
  </aspect>
    <aspect type="Omega">
    &#160;
  </aspect>
  </aspects>
  <skills>
    <mode rating="3" name="Super&#160;Soldier" stress-type="physical">
      <!-- ARRPG pg91 -->
      <skill name="Athletics" cost="2"/>
      <skill name="Combat" cost="2"/>
      <skill name="Contacts" cost="1"/>
      <skill name="Notice" cost="1"/>
      <skill name="Physique" cost="1"/>
      <skill name="Rapport" cost="1"/>
      <skill name="Stealth" cost="2"/>
      <skill name="Tactics" cost="0"/>
      <skill name="Will" cost="1"/>
    </mode>
    <mode rating="2" name="Soldier" stress-type="mental">
      <!-- ARRPG pg91 -->
      <skill name="Athletics" cost="2"/>
      <skill name="Combat" cost="2"/>
      <skill name="Contacts" cost="1"/>
      <skill name="Notice" cost="1"/>
      <skill name="Physique" cost="1"/>
      <skill name="Tactics" cost="0"/>
      <skill name="Vehicles" cost="2"/>
      <skill name="Will" cost="1"/>
    </mode>
    <mode rating="1" name="Action">
      <!-- ARRPG pg82 -->
      <skill name="Athletics" cost="2"/>
      <skill name="Combat" cost="2"/>
      <skill name="Notice" cost="1"/>
      <skill name="Physique" cost="1"/>
      <skill name="Provoke" cost="1"/>
      <skill name="Vehicles" cost="2"/>
    </mode>
  </skills>
  <stunts>
    <stunt name=" ">&#160;</stunt>
    <stunt name=" ">&#160;</stunt>
    <stunt name=" ">&#160;</stunt>
    <stunt name=" ">&#160;</stunt>
    <gadget name="Cap's Shield">
      <function>Throwable Vibranium Disc</function>
      <flaws>
        <flaw>Have to Hold It or Throw It, But Not Both</flaw>
      </flaws>
      <benefits>
        <benefit cost="1" name="Deflects a Machine Gun">
          +2 to Defend with Combat against firearms
        </benefit>
        <benefit cost="1" name="Swats a Grenade">
          +2 to Create an Advantage with Athletics when the shield could be narrated as useful
          (swatting a grenade, smashing through a door or window, etc.)
        </benefit>
      </benefits>
    </gadget>
  </stunts>
  <consequences/>
  <experiences>
    <experience/>
    <experience/>
    <experience/>
  </experiences>
  <notes/>
</character>
