<?xml version="1.0" encoding="utf8"?>
<?xml-stylesheet type="text/xsl" href="../../xslt/atomic-robo_html.xsl"?>
<!DOCTYPE atomic-robo SYSTEM "../AtomicRobo/atomic-robo.dtd">
<character>
  <id>
    <charname>Felicity Smoak</charname>
    <playername>Proto-NPC</playername>
    <affiliation>Arrow</affiliation>
    <description>Kind of looks like Emily Bett Rickards. With glasses.</description>
  </id>
  <current-fate-points>0</current-fate-points>
  <experience-points>0</experience-points>
  <aspects>
    <aspect type="Concept">Adorkable Hacker</aspect>
    <aspect type="Mode" mode-name="Science">Computers are TV Magic</aspect>
    <aspect type="Mode" mode-name="Banter">Did I Really Just Say That?</aspect>
    <aspect type="Mode" mode-name="Action">Hostage Got the Drop on You</aspect>
    <aspect type="Omega">No, Actually, I'm Jewish</aspect>
  </aspects>
  <skills>
    <mode rating="3" name="Science" stress-type="mental"> <!-- ARRPG pg85 -->
      <skill name="Computer Science"     cost="0" add="2"/>
      <skill name="Notice"               cost="1"/>
      <skill name="Will"                 cost="1"/>
      <skill name="(all other Sciences)" cost="1"/>
    </mode>
    <!--
       Specialize one trained skill.  Computer Science
       Focus one trained skill.
       Specialize one focused skill.
  -->
    <mode rating="2" name="Banter" stress-type="mental"> <!-- ARRPG pg83 -->
      <skill name="Contacts" cost="1"/>
      <skill name="Deceive"  cost="2"/>
      <skill name="Empathy"  cost="3"/>
      <skill name="Provoke"  cost="1"/>
      <skill name="Rapport"  cost="1" add="2"/> <!-- All Standard Modes improvement -->
      <skill name="Will"     cost="1"/>
    </mode>
    <mode rating="1" name="Action" stress-type="physical"> <!-- ARRPG pg82 -->
      <skill name="Athletics" cost="2"/>
      <skill name="Combat"    cost="2"/>
      <skill name="Notice"    cost="1"/>
      <skill name="Physique"  cost="1"/>
      <skill name="Provoke"   cost="1"/>
      <skill name="Vehicles"  cost="2"/>
    </mode>
  </skills>
  <stunts>
    <stunt name="Admin Access">
      Use Computer Science instead of Burglary to overcome computerized security systems.
    </stunt>
    <stunt name="There's An Algorithm For That">
      When using a technological device that has a computerized component - even a single microchip -
      spend a fate point to operate it using Computer Science instead of whatever other skill would
      normally apply until the end of the scene.
    </stunt>
    <stunt name=" ">&#160;</stunt>
    <stunt name=" ">&#160;</stunt>
    <stunt name=" ">&#160;</stunt>
  </stunts>
  <consequences/>
  <experiences>
    <experience/>
    <experience/>
    <experience/>
  </experiences>
  <notes>
  Regardless of what modes you have, if they're all standard modes you get ONE of the following improvements:
  X Specialize one trained skill. Rapport

  If one of your modes is Science, also apply ALL of the following improvements:
  X Specialize one trained skill. Computer Science
  * Focus one trained skill.
  * Specialize one focused skill.
 </notes>
</character>
