<?xml version = '1.0'?>
<?xml-stylesheet type="text/xsl" href="../../xslt/atomic-robo_html.xsl"?>
<!DOCTYPE atomic-robo SYSTEM "../AtomicRobo/atomic-robo.dtd">
<character>
 <id>
  <charname>Dennis Kim</charname>
  <playername>Supporting NPC</playername>
  <affiliation>Tesladyne SF (Resident Scientist NPC)</affiliation>
  <description>
    22-year old, scruffy, Phish T-shirt, acoustic guitar
    http://bigbangtheory.wikia.com/wiki/Dennis_Kim
  </description>
 </id>
 <current-fate-points>3</current-fate-points>
 <experience-points>0</experience-points>
 <aspects>
  <aspect type="Concept">Brilliant Stoner Resident Scientist</aspect>
  <aspect type="Mode" mode-name="Science">Literally Plays 11-Dimensional Chess</aspect>
  <aspect type="Mode" mode-name="Banter">Abrasive Boy Genius Who Mellowed Out (Mostly)</aspect>
  <aspect type="Mode" mode-name="Intrigue">Smuggled My Grandfather Out of North Korea</aspect>
  <aspect type="Omega">Youngest Recipient of the Stevenson Award</aspect>
 </aspects>
 <skills>
  <mode rating="3" name="Science" stress-type="mental">
   <skill name="Higher-Dimensional Math" add="2"/>
   <skill name="Notice"                  cost="1"/>
   <skill name="Pharmacology"            add="0"/>
   <skill name="Theoretical Physics"     add="2"/>
   <skill name="Will"                    cost="1"/>
   <skill name="(all other Sciences)"    cost="1"/>
  </mode>
  <mode rating="2" name="Banter" stress-type="mental"> <!-- ARRPG pg83 -->
   <skill name="Contacts" cost="1"/>
   <skill name="Deceive"  cost="2"/>
   <skill name="Empathy"  cost="3"/>
   <skill name="Notice"   cost="1"/>
   <skill name="Provoke"  cost="1" add="1"/>
   <skill name="Rapport"  cost="1"/>
   <skill name="Will"     cost="1"/>
  </mode>
  <mode rating="1" name="Intrigue"> <!-- ARRPG pg84 -->
   <skill name="Athletics" cost="2"/>
   <skill name="Burglary"  cost="1"/>
   <skill name="Contacts"  cost="1"/>
   <skill name="Deceive"   cost="2"/>
   <skill name="Notice"    cost="1"/>
   <skill name="Stealth"   cost="2"/>
  </mode>
 </skills>
 <stunts>
  <stunt name="Well-Earned Arrogance">
   +2 to Attack with Provoke when belittling or insulting the target [ARRPG269]
  </stunt>
  <stunt name="String Theory is a Dead End">
   +2 to Create an Advantage with Theoretical Physics when critiquing another's work
  </stunt>
  <stunt name="Wunderkind">
   +2 when using Theoretical Physics during a Brainstorm
  </stunt>
  <stunt name="Dime Bag">
   +2 to Create an Advantage with Contacts among stoners
  </stunt>
  <stunt name=" ">TBD</stunt>
 </stunts>
 <consequences>
 </consequences>
 <experiences>
  <experience/>
  <experience/>
  <experience/>
 </experiences>
 <notes/>
</character>
