<?xml version="1.0" encoding="utf8"?>
<?xml-stylesheet type="text/xsl" href="../../xslt/atomic-robo_html.xsl"?>
<!DOCTYPE atomic-robo SYSTEM "../AtomicRobo/atomic-robo.dtd">
<character>
  <id>
    <charname nickname="The Flash">Barry Allen</charname>
    <playername>Proto-NPC</playername>
    <affiliation>Central City Police Department</affiliation>
    <description>Kind of looks like Grant Gustin</description>
  </id>
  <current-fate-points>0</current-fate-points>
  <experience-points>0</experience-points>
  <aspects>
    <aspect type="Concept">Affable Straight-Laced Nerd</aspect>
    <aspect type="Mode" mode-name="Police&#160;Scientist">Quick Connections</aspect>
    <aspect type="Mode" mode-name="Action">Tireless</aspect>
    <aspect type="Mode" mode-name="Metahuman">The Fastest Man Alive</aspect>
    <aspect type="Omega">Obsessed with Father's Innocence and Iris</aspect>
  </aspects>
  <skills>
    <mode rating="3" name="Police&#160;Scientist" stress-type="mental">
      <skill name="Athletics" cost="2" add="1"/>
      <skill name="Chemistry" cost="0"/>
      <skill name="Combat"    cost="2"/>
      <skill name="Contacts"  cost="1"/>
      <skill name="Empathy"   cost="3"/>
      <skill name="Forensics" cost="0" add="2"/>
      <skill name="Notice"    cost="1"/>
      <skill name="Physics"   cost="0"/>
      <skill name="Will"      cost="1" add="1"/>
    </mode>
    <mode rating="2" name="Action" stress-type="physical"> <!-- ARRPG pg82 -->
      <skill name="Athletics" cost="2"/>
      <skill name="Combat"    cost="2"/>
      <skill name="Notice"    cost="1"/>
      <skill name="Physique"  cost="1"/>
      <skill name="Provoke"   cost="1"/>
      <skill name="Vehicles"  cost="2"/>
    </mode>
    <mode rating="1" name="Metahuman"> <!-- Reskin of Mutant, ARRPG pg88 -->
     <!--
          Specialize 2 Trained Skills: Forensics, ?
          Specialize 1 Focused Skill:  Athletics
          Focus      1 Trained Skill:  Will
     -->
    </mode>
  </skills>
  <stunts>
    <stunt name="Healing Factor">
      Once per scene, spend a fate point to reduce one of your consequences by one
      degree of severity (severe to major, major to mild, mild to nothing).
    </stunt>
    <stunt name="Super-Speed">
      Absolutely faster than any human, but at a cost (typically underestimating danger due to overconfidence).
    </stunt>
    <stunt name="The Streak">
      +2 to Overcome with Athletics when moving at Super-Speed.
    </stunt>
    <stunt name=" ">&#160;</stunt>
    <stunt name=" ">&#160;</stunt>
  </stunts>
  <consequences/>
  <experiences>
    <experience/>
    <experience/>
    <experience/>
  </experiences>
  <notes>
    Metahuman/Mutant Mode Improvements:
      Specialize 2 Trained Skills: Forensics, ?
      Specialize 1 Focused Skill:  Athletics
      Focus      1 Trained Skill:  Will
 </notes>
</character>
